{
  "users": [
    {
      "id": 1,
      "first_name": "Filmer",
      "last_name": "MacKessock",
      "email": "fmackessock0@barnesandnoble.com",
      "gender": "Male"
    },
    {
      "id": 2,
      "first_name": "Demetria",
      "last_name": "Drinan",
      "email": "ddrinan1@vk.com",
      "gender": "Female"
    },
    {
      "id": 3,
      "first_name": "Gunner",
      "last_name": "Savoury",
      "email": "gsavoury2@blogspot.com",
      "gender": "Male"
    },
    {
      "id": 4,
      "first_name": "Gretal",
      "last_name": "Fincken",
      "email": "gfincken3@amazon.de",
      "gender": "Female"
    },
    {
      "id": 5,
      "first_name": "Bu id edi"
    },
    {
      "id": 6,
      "first_name": "Vasily",
      "last_name": "Penton",
      "email": "vpenton5@squidoo.com",
      "gender": "Male"
    },
    {
      "id": 7,
      "first_name": "Dorita",
      "last_name": "McKoy",
      "email": "dmckoy6@nationalgeographic.com",
      "gender": "Agender"
    },
    {
      "id": 8,
      "first_name": "Traci",
      "last_name": "Madgwick",
      "email": "tmadgwick7@sitemeter.com",
      "gender": "Female"
    },
    {
      "id": 9,
      "first_name": "Garner",
      "last_name": "Pawling",
      "email": "gpawling8@guardian.co.uk",
      "gender": "Male"
    },
    {
      "id": 10,
      "first_name": "Julissa",
      "last_name": "Bilfoot",
      "email": "jbilfoot9@g.co",
      "gender": "Female"
    },
    {
      "id": 11,
      "first_name": "Ailsun",
      "last_name": "Goodlett",
      "email": "agoodletta@tmall.com",
      "gender": "Female"
    },
    {
      "id": 12,
      "first_name": "Kinsley",
      "last_name": "Midlane",
      "email": "kmidlaneb@aboutads.info",
      "gender": "Male"
    },
    {
      "id": 13,
      "first_name": "Carolan",
      "last_name": "Giovannetti",
      "email": "cgiovannettic@surveymonkey.com",
      "gender": "Female"
    },
    {
      "id": 14,
      "first_name": "Seline",
      "last_name": "Langfitt",
      "email": "slangfittd@cyberchimps.com",
      "gender": "Polygender"
    },
    {
      "id": 15,
      "first_name": "Even",
      "last_name": "Lambert-Ciorwyn",
      "email": "elambertciorwyne@cbsnews.com",
      "gender": "Male"
    },
    {
      "id": 16,
      "first_name": "Zorah",
      "last_name": "Brabham",
      "email": "zbrabhamf@howstuffworks.com",
      "gender": "Female"
    },
    {
      "id": 17,
      "first_name": "Nonna",
      "last_name": "Lowmass",
      "email": "nlowmassg@slashdot.org",
      "gender": "Female"
    },
    {
      "id": 18,
      "first_name": "Delmor",
      "last_name": "Lindstrom",
      "email": "dlindstromh@networksolutions.com",
      "gender": "Male"
    },
    {
      "id": 19,
      "first_name": "Evaleen",
      "last_name": "Karpf",
      "email": "ekarpfi@istockphoto.com",
      "gender": "Female"
    },
    {
      "id": 20,
      "first_name": "Ingeborg",
      "last_name": "Crady",
      "email": "icradyj@skype.com",
      "gender": "Female"
    },
    {
      "id": 21,
      "first_name": "Hilary",
      "last_name": "Dahlborg",
      "email": "hdahlborgk@ft.com",
      "gender": "Female"
    },
    {
      "id": 22,
      "first_name": "Jane",
      "last_name": "Yegorev",
      "email": "jyegorevl@flickr.com",
      "gender": "Female"
    },
    {
      "id": 23,
      "first_name": "Kellia",
      "last_name": "McShea",
      "email": "kmcsheam@umn.edu",
      "gender": "Non-binary"
    },
    {
      "id": 24,
      "first_name": "Harrison",
      "last_name": "Akaster",
      "email": "hakastern@nydailynews.com",
      "gender": "Bigender"
    }
  ],
  "product":[
    {
      "name":"XBOX GAME PASS ULTIMATE + EA PLAY 14 JOURS | RENOUVELL...",
      "price":16400,
      "type":"origin",
      "discount":15,
      "category":"Account",
      "img":"https://i.ibb.co/HHTkVPr/unsplash-F-5g8-EEHYE-4.png",
      "describe":"Mincraft"
    },
    {
      "name":"XBOX GAME PASS ULTIMATE + EA PLAY 14 JOURS | RENOUVELL...",
      "price":16400,
      "type":"origin",
      "discount":15,
      "category":"Account",
      "img":"https://i.ibb.co/NCWCFjn/Rectangle-3313-1.png",
      "describe":"Mincraft"
    },
    {
      "name":"XBOX GAME PASS ULTIMATE + EA PLAY 14 JOURS | RENOUVELL...",
      "price":16400,
      "type":"origin",
      "discount":15,
      "category":"Account",
      "img":"https://i.ibb.co/VYKvkRP/Rectangle-3313-2.png",
      "describe":"Mincraft"
    },
    {
      "name":"XBOX GAME PASS ULTIMATE + EA PLAY 14 JOURS | RENOUVELL...",
      "price":16400,
      "type":"origin",
      "discount":15,
      "category":"Account",
      "img":"https://i.ibb.co/W6qFpWt/Rectangle-3313-3.png"
    }
  ],
  "games":[
    {
      "name":"XBOX GAME PASS ULTIMATE + EA PLAY 14 JOURS | RENOUVELL...",
      "price":16400,
      "type":"origin",
      "discount":15,
      "category":"Account",
      "img":"https://i.ibb.co/HHTkVPr/unsplash-F-5g8-EEHYE-4.png",
      "describe":"Mincraft"
    },
    {
      "name":"XBOX GAME PASS ULTIMATE + EA PLAY 14 JOURS | RENOUVELL...",
      "price":16400,
      "type":"origin",
      "discount":15,
      "category":"Account",
      "img":"https://i.ibb.co/NCWCFjn/Rectangle-3313-1.png",
      "describe":"Mincraft"
    },
    {
      "name":"XBOX GAME PASS ULTIMATE + EA PLAY 14 JOURS | RENOUVELL...",
      "price":16400,
      "type":"origin",
      "discount":15,
      "category":"Account",
      "img":"https://i.ibb.co/VYKvkRP/Rectangle-3313-2.png",
      "describe":"Mincraft"
    },
    {
      "name":"XBOX GAME PASS ULTIMATE + EA PLAY 14 JOURS | RENOUVELL...",
      "price":16400,
      "type":"origin",
      "discount":15,
      "category":"Account",
      "img":"https://i.ibb.co/W6qFpWt/Rectangle-3313-3.png"
    },
    {
      "name":"XBOX GAME PASS ULTIMATE + EA PLAY 14 JOURS | RENOUVELL...",
      "price":16400,
      "type":"origin",
      "discount":15,
      "category":"Account",
      "img":"https://i.ibb.co/phSVm2N/unsplash-F-5g8-EEHYE.png",
      "describe":"Mincraft"
    },
    {
      "name":"XBOX GAME PASS ULTIMATE + EA PLAY 14 JOURS | RENOUVELL...",
      "price":16400,
      "type":"origin",
      "discount":15,
      "category":"Account",
      "img":"https://i.ibb.co/0fcT74N/unsplash-F-5g8-EEHYE-2.png",
      "describe":"Mincraft"
    },
    {
      "name":"XBOX GAME PASS ULTIMATE + EA PLAY 14 JOURS | RENOUVELL...",
      "price":16400,
      "type":"origin",
      "discount":15,
      "category":"Account",
      "img":"https://i.ibb.co/8XMMwS5/unsplash-F-5g8-EEHYE-3.png",
      "describe":"Mincraft"
    },
    {
      "name":"XBOX GAME PASS ULTIMATE + EA PLAY 14 JOURS | RENOUVELL...",
      "price":16400,
      "type":"origin",
      "discount":15,
      "category":"Account",
      "img":"https://i.ibb.co/HHTkVPr/unsplash-F-5g8-EEHYE-4.png",
      "describe":"Mincraft"
    },
    {
      "name":"XBOX GAME PASS ULTIMATE + EA PLAY 14 JOURS | RENOUVELL...",
      "price":16400,
      "type":"origin",
      "discount":15,
      "category":"Account",
      "img":"https://i.ibb.co/MBYygSS/unsplash-F-5g8-EEHYE-5.png",
      "describe":"Mincraft"
    },
    {
      "name":"XBOX GAME PASS ULTIMATE + EA PLAY 14 JOURS | RENOUVELL...",
      "price":16400,
      "type":"origin",
      "discount":15,
      "category":"Account",
      "img":"https://i.ibb.co/WVtSYRj/unsplash-F-5g8-EEHYE-6.png",
      "describe":"Mincraft"
    },
    {
      "name":"XBOX GAME PASS ULTIMATE + EA PLAY 14 JOURS | RENOUVELL...",
      "price":16400,
      "type":"origin",
      "discount":15,
      "category":"Account",
      "img":"https://i.ibb.co/whMNrXN/unsplash-F-5g8-EEHYE-7.png",
      "describe":"Mincraft"
    },
    {
      "name":"XBOX GAME PASS ULTIMATE + EA PLAY 14 JOURS | RENOUVELL...",
      "price":16400,
      "type":"origin",
      "discount":15,
      "category":"Account",
      "img":"https://i.ibb.co/h9x3pXj/unsplash-F-5g8-EEHYE-8.png",
      "describe":"Mincraft"
    }
  ],
  "promo":[
    {
      "name":"XBOX GAME PASS ULTIMATE + EA PLAY 14 JOURS | RENOUVELL...",
      "price":16400,
      "type":"origin",
      "discount":15,
      "category":"Account",
      "img":"https://i.ibb.co/0fj80gt/Rectangle-3332.png",
      "describe":"Mincraft"
    },
    {
      "name":"XBOX GAME PASS ULTIMATE + EA PLAY 14 JOURS | RENOUVELL...",
      "price":16400,
      "type":"origin",
      "discount":15,
      "category":"Account",
      "img":"https://i.ibb.co/N19DDBk/Rectangle-3332-1.png",
      "describe":"Mincraft"
    },
    {
      "name":"XBOX GAME PASS ULTIMATE + EA PLAY 14 JOURS | RENOUVELL...",
      "price":16400,
      "type":"origin",
      "discount":15,
      "category":"Account",
      "img":"https://i.ibb.co/xfvsLT8/Rectangle-3332-2.png",
      "describe":"Mincraft"
    },
    {
      "name":"XBOX GAME PASS ULTIMATE + EA PLAY 14 JOURS | RENOUVELL...",
      "price":16400,
      "type":"origin",
      "discount":15,
      "category":"Account",
      "img":"https://i.ibb.co/dk89S8c/Rectangle-3332-3.png",
      "describe":"Mincraft"
    }
  ],
  "cars":[
    {
      "make": "Mercedes-Benz",
      "model": "E-Class",
      "year": 2023,
      "price": "$64,900",
      "engine": "3.0L Inline 6 Turbo with EQ Boost",
      "transmission": "9-Speed Automatic",
      "topSpeed": "155 mph",
      "variant": "E 450 4MATIC",
      "description": "The 2023 Mercedes-Benz E-Class is a luxurious midsize car that combines elegant style with thrilling performance. Equipped with a 3.0L Inline 6 Turbo engine with EQ Boost, producing 362 horsepower and 369 lb-ft of torque, paired with a 9-Speed Automatic transmission, the E-Class is capable of reaching 60 mph in just 5.0 seconds. With a top speed of 155 mph, you'll enjoy a smooth and exhilarating driving experience every time you get behind the wheel. The E 450 4MATIC variant features all-wheel drive and a range of premium features, including a Burmester Surround Sound System, 12.3-inch touchscreen display, and wireless charging. Discover the ultimate in luxury and performance with the 2023 Mercedes-Benz E-Class.",
      "imgLink": "https://example.com/images/2023-mercedes-benz-e-class.jpg"
    },
    {
      "make": "Mercedes-Benz",
      "model": "S-Class",
      "year": 2022,
      "price": "$110,000",
      "engine": "4.0L V8 Biturbo with EQ Boost",
      "transmission": "9-Speed Automatic",
      "topSpeed": "130 mph",
      "variant": "S 580 4MATIC",
      "description": "The 2022 Mercedes-Benz S-Class is a flagship luxury sedan that sets the standard for sophistication and style. Powered by a 4.0L V8 Biturbo engine with EQ Boost, producing 496 horsepower and 516 lb-ft of torque, paired with a 9-Speed Automatic transmission, the S-Class is capable of reaching 60 mph in just 4.5 seconds. With a top speed of 130 mph, you'll enjoy a smooth and comfortable driving experience every time you get behind the wheel. The S 580 4MATIC variant features all-wheel drive and a range of premium features, including a 31-speaker Burmester High-End 3D Surround Sound System, 12.8-inch OLED touchscreen display, and MBUX Interior Assistant. Experience the ultimate in luxury and performance with the 2022 Mercedes-Benz S-Class.",
      "imgLink": "https://example.com/images/2022-mercedes-benz-s-class.jpg"
    },
    {
      "make": "Mercedes-Benz",
      "model": "GLA-Class",
      "year": 2022,
      "price": "$39,350",
      "engine": "2.0L Inline 4 Turbo",
      "transmission": "8-Speed Dual-Clutch Automatic",
      "topSpeed": "130 mph",
      "variant": "GLA 250",
      "description": "The 2022 Mercedes-Benz GLA-Class is a compact SUV that combines versatility with thrilling performance. Equipped with a 2.0L Inline 4 Turbo engine, producing 221 horsepower and 258 lb-ft of torque, paired with an 8-Speed Dual-Clutch Automatic transmission, the GLA 250 is capable of reaching 60 mph in just 6.8 seconds. With a top speed of 130 mph, you'll enjoy a smooth and comfortable driving experience every time you get behind the wheel. The GLA 250 variant features a range of premium features, including a panoramic sunroof, 10.25-inch touchscreen display, and Apple CarPlay/Android Auto compatibility. With its spacious interior, advanced safety features, and impressive performance, the 2022 Mercedes-Benz GLA-Class is the perfect SUV for drivers who demand both luxury and versatility.",
      "imgLink": "https://example.com/images/2022-mercedes-benz-gla-class.jpg"
      },
      {
        "make": "Mercedes-Benz",
        "model": "C-Class",
        "year": 2023,
        "price": "$41,600",
        "engine": "2.0L Inline 4 Turbo",
        "transmission": "9-Speed Automatic",
        "topSpeed": "130 mph",
        "variant": "C 300 4MATIC",
        "description": "The 2023 Mercedes-Benz C-Class is a sleek and stylish luxury sedan that offers impressive performance and advanced technology. Powered by a 2.0L Inline behind the wheel. The C-Class boasts a sophisticated interior with premium materials and advanced features, such as a 12.3-inch digital instrument cluster and a 11.9-inch touchscreen display with MBUX voice command technology. Additionally, the C 300 4MATIC comes with 4MATIC all-wheel drive, providing improved traction and handling in any driving condition. With its combination of performance, luxury, and technology, the 2023 Mercedes-Benz C-Class is a top contender in the luxury sedan segment.",
        "imgLink": "https://example.com/images/2023-mercedes-benz-c-class.jpg"
        },
        {
          "make": "Mercedes-Benz",
          "model": "E-Class",
          "year": 2022,
          "price": "$59,050",
          "engine": "2.0L Inline 4 Turbo + EQ Boost",
          "transmission": "9-Speed Automatic",
          "topSpeed": "130 mph",
          "variant": "E 350 4MATIC",
          "description": "The 2022 Mercedes-Benz E-Class is a luxurious midsize sedan that offers a perfect balance of comfort, performance, and advanced technology. Powered by a 2.0L Inline 4 Turbo engine with EQ Boost, producing a total of 255 horsepower and 295 lb-ft of torque, paired with a 9-Speed Automatic transmission, the E 350 4MATIC is capable of reaching 60 mph in just 6.0 seconds. With a top speed of 130 mph, you'll enjoy a smooth and responsive driving experience every time you get behind the wheel. The E-Class boasts a spacious and elegant interior, with comfortable seats and advanced features such as a 12.3-inch digital instrument cluster and a 12.8-inch OLED touchscreen display with MBUX voice command technology. The E 350 4MATIC also comes with 4MATIC all-wheel drive, providing improved traction and handling in any driving condition. With its exceptional performance and luxurious features, the 2022 Mercedes-Benz E-Class is a top choice for drivers seeking a premium midsize sedan.",
          "imgLink": "https://example.com/images/2022-mercedes-benz-e-class.jpg"
          },
          {
            "make": "Mercedes-Benz",
            "model": "E-Class",
            "year": 2022,
            "price": "$59,050",
            "engine": "2.0L Inline 4 Turbo + EQ Boost",
            "transmission": "9-Speed Automatic",
            "topSpeed": "130 mph",
            "variant": "E 350 4MATIC",
            "description": "The 2022 Mercedes-Benz E-Class is a luxurious midsize sedan that offers a perfect balance of comfort, performance, and advanced technology. Powered by a 2.0L Inline 4 Turbo engine with EQ Boost, producing a total of 255 horsepower and 295 lb-ft of torque, paired with a 9-Speed Automatic transmission, the E 350 4MATIC is capable of reaching 60 mph in just 6.0 seconds. With a top speed of 130 mph, you'll enjoy a smooth and responsive driving experience every time you get behind the wheel. The E-Class boasts a spacious and elegant interior, with comfortable seats and advanced features such as a 12.3-inch digital instrument cluster and a 12.8-inch OLED touchscreen display with MBUX voice command technology. The E 350 4MATIC also comes with 4MATIC all-wheel drive, providing improved traction and handling in any driving condition. With its exceptional performance and luxurious features, the 2022 Mercedes-Benz E-Class is a top choice for drivers seeking a premium midsize sedan.",
            "imgLink": "https://example.com/images/2022-mercedes-benz-e-class.jpg"
            },
            {
              "make": "Mercedes-Benz",
              "model": "GLE-Class",
              "year": 2022,
              "price": "$56,750",
              "engine": "2.0L Inline 4 Turbo + EQ Boost",
              "transmission": "9-Speed Automatic",
              "topSpeed": "130 mph",
              "variant": "GLE 350 4MATIC",
              "description": "The 2022 Mercedes-Benz GLE-Class is a midsize luxury SUV that combines comfort, versatility, and performance. Powered by a 2.0L Inline 4 Turbo engine with EQ Boost, producing a total of 255 horsepower and 273 lb-ft of torque, paired with a 9-Speed Automatic transmission, the GLE 350 4MATIC is capable of reaching 60 mph in just 7.0 seconds. With a top speed of 130 mph, you'll enjoy a smooth and capable driving experience every time you get behind the wheel. The GLE-Class features a spacious and luxurious interior, with comfortable seating for up to five passengers and a range of advanced features such as a 12.3-inch digital instrument cluster and a 12.8-inch OLED touchscreen display with MBUX voice command technology. The GLE 350 4MATIC also comes with 4MATIC all-wheel drive, providing improved traction and handling in any driving condition. With its combination of performance, luxury, and versatility, the 2022 Mercedes-Benz GLE-Class is an excellent choice for drivers seeking a premium midsize SUV.",
              "imgLink": "https://example.com/images/2022-mercedes-benz-gle-class.jpg"
              },
              {
                "make": "Mercedes-Benz",
                "model": "GLC-Class",
                "year": 2022,
                "price": "$43,200",
                "engine": "2.0L Inline 4 Turbo",
                "transmission": "9-Speed Automatic",
                "topSpeed": "130 mph",
                "variant": "GLC 300",
                "description": "The 2022 Mercedes-Benz GLC-Class is a compact luxury SUV that offers a winning combination of performance, comfort, and advanced technology. Powered by a 2.0L Inline 4 Turbo engine, producing 255 horsepower and 273 lb-ft of torque, paired with a 9-Speed Automatic transmission, the GLC 300 is capable of reaching 60 mph in just 6.4 seconds. With a top speed of 130 mph, you'll enjoy a smooth and responsive driving experience every time you get behind the wheel. The GLC-Class features a stylish and luxurious interior, with comfortable seating for up to five passengers and advanced features such as a 10.25-inch touchscreen display with MBUX voice command technology and a range of advanced safety features such as Active Brake Assist and ATTENTION ASSIST. With its combination of performance, luxury, and advanced technology, the 2022 Mercedes-Benz GLC-Class is a top contender in the competitive compact luxury SUV segment.",
                "imgLink": "https://example.com/images/2022-mercedes-benz-glc-class.jpg"
                },
                {
                  "make": "Mercedes-Benz",
                  "model": "GLS-Class",
                  "year": 2022,
                  "price": "$77,350",
                  "engine": "3.0L Inline 6 Turbo + EQ Boost",
                  "transmission": "9-Speed Automatic",
                  "topSpeed": "130 mph",
                  "variant": "GLS 450 4MATIC",
                  "description": "The 2022 Mercedes-Benz GLS-Class is a full-size luxury SUV that offers spacious and luxurious seating for up to seven passengers, advanced technology, and powerful performance. Powered by a 3.0L Inline 6 Turbo engine with EQ Boost, producing 362 horsepower and 369 lb-ft of torque, paired with a 9-Speed Automatic transmission, the GLS 450 4MATIC is capable of reaching 60 mph in just 5.9 seconds. With a top speed of 130 mph, you'll enjoy a smooth and powerful driving experience every time you get behind the wheel. The GLS-Class features a spacious and luxurious interior, with comfortable seating for up to seven passengers and advanced features such as a 12.3-inch digital instrument cluster, a 12.8-inch OLED touchscreen display with MBUX voice command technology, and a Burmester 3D sound system. The GLS 450 4MATIC also comes with 4MATIC all-wheel drive, providing improved traction and handling in any driving condition. With its combination of luxury, technology, and powerful performance, the 2022 Mercedes-Benz GLS-Class is the ultimate full-size luxury SUV.",
                  "imgLink": "https://example.com/images/2022-mercedes-benz-gls-class.jpg"
                  },
                  {
                    "make": "Mercedes-Benz",
                    "model": "A-Class",
                    "year": 2022,
                    "price": "$33,650",
                    "engine": "2.0L Inline 4 Turbo",
                    "transmission": "7-Speed Dual-Clutch Automatic",
                    "topSpeed": "130 mph",
                    "variant": "A 220 4MATIC",
                    "description": "The 2022 Mercedes-Benz A-Class is a compact luxury sedan that offers a combination of style, performance, and advanced technology. Powered by a 2.0L Inline 4 Turbo engine, producing 188 horsepower and 221 lb-ft of torque, paired with a 7-Speed Dual-Clutch Automatic transmission, the A 220 4MATIC is capable of reaching 60 mph in just 7.1 seconds. With a top speed of 130 mph, you'll enjoy a smooth and responsive driving experience every time you get behind the wheel. The A-Class features a stylish and modern interior, with comfortable seating for up to five passengers and advanced features such as a 10.25-inch touchscreen display with MBUX voice command technology and a range of advanced safety features such as Active Brake Assist and ATTENTION ASSIST. With its combination of style, performance, and advanced technology, the 2022 Mercedes-Benz A-Class is an excellent choice for drivers seeking a premium compact sedan.",
                    "imgLink": "https://example.com/images/2022-mercedes-benz-a-class.jpg"
                    }
    
  ]


}